"g.  Pengakuan Pendapatan dan Beban",""
"Pendapatan  bunga  dari  efek  utang,  deposito  berjangka  dan","jasa  giro  diakui  secara  akrual"
"","berdasarkan proporsi waktu.  Keuntungan (kerugian)  investasi yang telah dan belum  direalisasi"
"","diakui dalam laporan laba rugi dan penghasilan komprehensif lain periode berjalan dan laporan"
"perubahan aset bersih tahun berjalan.",""
"","Beban jasa pengelolaan investasi, beban jasa  kustodian dan beban jasa lain-lain diakui secara"
"akrual harian.",""
